our_signal,relationship,ag_finding,ag_dollar,ag_detail
Federal dependency ~45-49% of revenue (Fund Flow),CORROBORATES,FY24 Highlights,$28.6B fed exp / $30.8B fed rev,"AG: federal grants = 49.0% of FY24 revenue, single largest source; our checkbook-cash measure (~45%) lands within methodology gap (ACFR accrual vs cash)."
"AHCCCS = #1 federal exposure (81% of $20.4B)",CORROBORATES,"2024-21, 2024-22, 2024-120",$384.8M+$30.5M restatements; sober-living fraud undetermined,AG: AHCCCS = 57.3% ($16.4B) of all federal spend; financials restated for errors; 300+ sober-living providers suspended for fraudulent behavioral-health billing since May 2023.
"DES = #2 federal exposure (97%)",CORROBORATES,"2024-05,06,07,104,107",$257.4M unsupported; $19.9M unreconciled; $51.3M; $2.88M; $64k,"AG: DES UI bank recs incomplete (fraud risk), $257.4M COVID UI unsupported, childcare/rental payments lacked eligibility docs. DES = 13% ($3.7B) of federal spend, 6 findings (most of any agency)."
Procurement Flags — competition/process irregularities exist,CORROBORATES,2024-111,$37.3M to 57 vendors,AG: ADE used improper procurement (no fair/open competition) on Education Stabilization Fund; unauthorized employees signed a noncompetitive waiver.
Vendor concentration: Corrections->NaphCare 41% ($1B agency),EXTENDS,2024-10,$50.9M,AG: Corrections (DCRR) spent $50.9M opioid-settlement monies without documentation of allowable use.
Payroll analysis impossible (hourly_rate 100% empty),CORROBORATES (our limitation),2024-116,$1.7M,AG independently found DEMA lacked pay-rate documentation on $1.7M federal payroll — the exact category our data cannot see; confirms a real gap our feed cannot cover.
"Data-quality/control trend degrading (rising sentinels, FY24-25)",CORROBORATES,2024-101; Figure 3,—,"AG: ACFR filed ~13 months late; uncorrected federal findings rose 8 (FY19) -> 42 (FY24). Independent confirmation that control quality is deteriorating, not improving."
"FY2024 cash-margin = -3.2% / -$1.9B (Governance scorecard, ""watch"")",CORRECTS,FY24 Highlights p.2,+$259M net position,"AG accrual ACFR: State net position INCREASED $259M in FY24 (rev > exp). Our cash-basis proxy diverges ~$2.2B; the FY24 ""watch"" must NOT be read as accrual deterioration. Exactly the cash-vs-GAAP caveat in our methodology."
